{
  "InvoiceNumber": "INV1003",
  "InvoiceDate": "2024-02-19",
  "DueDate": "2024-02-20",
  "Terms": "Next Day",
  "BusinessName": "Bluepeak Studio",
  "BusinessEmail": "hello@bluepeakstudio.com",
  "BusinessAddress": "846 Birch Court, Springfield",
  "BusinessPhone": "(781) 550 8267",
  "ClientName": "Cameron Davis",
  "ClientEmail": "cameron@robinsonmail.com",
  "ClientAddress": "327 Chestnut Blvd, Georgetown",
  "ClientPhone": "012 358 64865"
}
